{"engines":{"firewall":"4.3.0","scanner":"3.0.0"},"isolation":{"target_code_executed":false,"worker_network":"NONE"},"limitations":["Project names identify public open-source repositories included in this weekly review index.","Inclusion does not indicate a vulnerability, endorsement, certification, ranking, or accusation.","Technical findings, paths, snippets, rules, secrets, and exact results are not published.","Project names and links are used nominatively to identify the reviewed public repositories."],"period":{"end":"2026-07-26","start":"2026-07-20"},"projects":[{"license_spdx":"MIT","name":"coderisktools-fixtures/project-alpha","review_status":"REVIEW_COMPLETED","url":"https://github.com/coderisktools-fixtures/project-alpha"},{"license_spdx":"Apache-2.0","name":"coderisktools-fixtures/project-beta","review_status":"REVIEW_COMPLETED","url":"https://github.com/coderisktools-fixtures/project-beta"},{"license_spdx":"BSD-3-Clause","name":"coderisktools-fixtures/project-gamma","review_status":"REVIEW_COMPLETED","url":"https://github.com/coderisktools-fixtures/project-gamma"}],"publication":{"exact_results":"NOT_PUBLISHED","project_level_conclusion":"NONE","project_names":"PUBLISHED_FOR_EDITORIAL_INDEXING","technical_findings":"NOT_PUBLISHED"},"result":"NAMED_PROJECT_REVIEWS_COMPLETED_NO_PROJECT_LEVEL_SECURITY_CONCLUSION","schema":"coderisktools.observatory.named-weekly-review.v1","week":"2026-W30"}
